[
  { "id": "ASM-01", "name": "Software engineers", "team": "swe", "unit": "people", "conservative": 120, "base": 120, "upside": 120, "basis": "brief/facts.json", "editableInCalculator": true },
  { "id": "ASM-02", "name": "Data scientists", "team": "ds", "unit": "people", "conservative": 40, "base": 40, "upside": 40, "basis": "brief/facts.json", "editableInCalculator": true },
  { "id": "ASM-03", "name": "Site reliability engineers", "team": "sre", "unit": "people", "conservative": 20, "base": 20, "upside": 20, "basis": "brief/facts.json", "editableInCalculator": true },
  { "id": "ASM-04", "name": "Fully loaded annual cost per technical employee", "team": "all", "unit": "USD/year", "conservative": 170000, "base": 200000, "upside": 230000, "basis": "assumption: typical US fintech salary plus ~30% benefits and overhead; replace with FinTechCo HR's figure", "editableInCalculator": true },
  { "id": "ASM-05", "name": "Productive hours per year", "team": "all", "unit": "hours", "conservative": 1840, "base": 1840, "upside": 1840, "basis": "assumption: 46 working weeks x 40 hours", "editableInCalculator": false },
  { "id": "ASM-06", "name": "Hours saved per active user per week", "team": "all", "unit": "hours/week", "conservative": 2, "base": 4, "upside": 6, "basis": "assumption bounded by evidence: base 4h = 10% of a 40h week, below the 26% more completed tasks in field experiments at Microsoft and Accenture [CLM-623] and ~21% less time on task at Google [CLM-652]; conservative 2h allows for results where experienced developers were slower [CLM-650] [CLM-651]. The pilot replaces this with FinTechCo's measured value.", "editableInCalculator": true },
  { "id": "ASM-07", "name": "Active users at steady state (share of staff)", "team": "all", "unit": "share", "conservative": 0.6, "base": 0.75, "upside": 0.9, "basis": "assumption: share of licensed staff active in a given month after rollout; measured by Claude Code analytics [CLM-657]", "editableInCalculator": true },
  { "id": "ASM-08", "name": "Realization factor (share of saved time that becomes delivered work)", "team": "all", "unit": "share", "conservative": 0.5, "base": 0.6, "upside": 0.7, "basis": "assumption: not every saved hour turns into output; DORA finds returns depend on surrounding practices [CLM-654]", "editableInCalculator": true },
  { "id": "ASM-09", "name": "Claude Code usage cost per active user per month", "team": "all", "unit": "USD/month", "conservative": 250, "base": 200, "upside": 150, "basis": "Anthropic's published enterprise average of $150-250 per developer per month [CLM-619]; actual FinTechCo pricing to be quoted", "editableInCalculator": true },
  { "id": "ASM-10", "name": "Enablement hours per person (one-time)", "team": "all", "unit": "hours", "conservative": 8, "base": 6, "upside": 4, "basis": "assumption: workshop plus practice time, valued at loaded cost", "editableInCalculator": true },
  { "id": "ASM-11", "name": "Platform and governance team (ongoing)", "team": "all", "unit": "FTE", "conservative": 1, "base": 0.5, "upside": 0.5, "basis": "assumption: center-of-excellence time for policy, MCP approvals, monitoring and enablement (rollout/rollout-plan.md)", "editableInCalculator": true },
  { "id": "ASM-12", "name": "Months to reach steady-state adoption", "team": "all", "unit": "months", "conservative": 6, "base": 4, "upside": 3, "basis": "assumption: matches the ~4-month rollout in rollout/rollout-plan.md; adoption ramps linearly to steady state", "editableInCalculator": true }
]
